{
  "case_id": "BenchmarkTest00001",
  "source_observed": "HttpServletRequest.getCookies",
  "sink_observed": "java.io.FileInputStream.<init>",
  "sink_tainted": true,
  "runtime_path": [
    "org.owasp.benchmark.testcode.BenchmarkTest00001.doPost",
    "java.io.FileInputStream.<init>:TAINT_PROPAGATED",
    "HttpServletResponse.getWriter:TAINT_PROPAGATED"
  ],
  "exit_code": 0,
  "timeout": false,
  "instrumentation_status": "ACTIVE",
  "execution_time_ms": 225,
  "timestamp": "2026-09-15T09:11:44.349Z",
  "artifact_hashes": {
    "taint_result": "2f5efeca97eb35b906eb57dbed226dcf75874837c7e0984e4567d2fd760f99fa",
    "stdout_sha256": "fdcd43dc874209e12f5a0c160e630765f5fa368ae98f040ebcec24bafc9e5ff5",
    "stderr_sha256": "e3b0c44298fc1c149afbf4c8996fb92427ae41e4649b934ca495991b7852b855"
  }
}